{
  "$schema": "../../schemas/workflow-permissions.schema.json",
  "schemaVersion": 2,
  "pluginNamespace": "nova-plugin",
  "knownGoodClaudeCli": "2.1.205",
  "primaryEntrypoints": [
    "route",
    "explore",
    "produce-plan",
    "review",
    "implement-plan",
    "finalize-work"
  ],
  "toolVocabulary": [
    "Read",
    "Glob",
    "Grep",
    "Edit",
    "Write",
    "Bash",
    "NotebookEdit"
  ],
  "expectedInventory": {
    "combinedSkillCount": 27,
    "commandIds": [
      "backend-plan",
      "codex-review-fix",
      "codex-review-only",
      "codex-verify-only",
      "explore",
      "explore-lite",
      "explore-review",
      "finalize-lite",
      "finalize-work",
      "implement-lite",
      "implement-plan",
      "implement-standard",
      "plan-lite",
      "plan-review",
      "produce-plan",
      "review",
      "review-lite",
      "review-only",
      "review-strict",
      "route",
      "senior-explore"
    ],
    "skillNames": [
      "nova-explore",
      "nova-finalize-work",
      "nova-implement-plan",
      "nova-produce-plan",
      "nova-review",
      "nova-route"
    ]
  },
  "workflows": [
    {
      "id": "backend-plan",
      "canonicalSurfaceId": "produce-plan",
      "variantPreset": {
        "PLAN_PROFILE": "java-backend"
      },
      "compatibilityAlias": true,
      "destructiveActions": "low",
      "modelInvocable": false,
      "subagentSafe": true,
      "allowedTools": [
        "Read",
        "Glob",
        "Grep",
        "Write",
        "Edit"
      ],
      "disallowedTools": [
        "NotebookEdit",
        "Bash"
      ],
      "runtimeRequirements": {
        "executables": [],
        "network": {
          "need": "none",
          "purpose": "none"
        },
        "credentials": {
          "need": "none",
          "source": "none"
        }
      },
      "permissionPolicy": {
        "workspaceRead": "preapproved",
        "workspaceWrite": "preapproved",
        "shell": "denied",
        "network": "denied",
        "credentials": "denied",
        "userScopeMutation": "denied",
        "externalPublish": "denied",
        "gitHistoryMutation": "denied"
      },
      "enforcement": {
        "claude": "native-and-hook",
        "codex": "adapter",
        "generic": "advisory"
      },
      "legacyCapabilities": {
        "workspaceRead": true,
        "workspaceWrite": true,
        "shell": "denied",
        "network": false,
        "credentials": false,
        "userScopeMutation": false,
        "externalPublish": false,
        "gitHistoryMutation": false
      }
    },
    {
      "id": "codex-review-fix",
      "canonicalSurfaceId": "implement-plan",
      "variantPreset": {
        "EXECUTION_PROFILE": "codex-review-fix"
      },
      "compatibilityAlias": true,
      "destructiveActions": "medium",
      "modelInvocable": false,
      "subagentSafe": false,
      "allowedTools": [
        "Read",
        "Glob",
        "Grep",
        "Write",
        "Edit"
      ],
      "disallowedTools": [
        "NotebookEdit"
      ],
      "runtimeRequirements": {
        "executables": [
          {
            "name": "node",
            "required": true,
            "versionEvidence": "versioned-evidence"
          },
          {
            "name": "bash",
            "required": true,
            "versionEvidence": "versioned-evidence"
          },
          {
            "name": "codex",
            "required": true,
            "versionEvidence": "versioned-evidence"
          }
        ],
        "network": {
          "need": "required",
          "purpose": "external review, fix, and verification"
        },
        "credentials": {
          "need": "required",
          "source": "assistant-owned-authentication"
        }
      },
      "permissionPolicy": {
        "workspaceRead": "preapproved",
        "workspaceWrite": "preapproved",
        "shell": "prompt",
        "network": "prompt",
        "credentials": "explicit",
        "userScopeMutation": "denied",
        "externalPublish": "denied",
        "gitHistoryMutation": "denied"
      },
      "enforcement": {
        "claude": "native-and-hook",
        "codex": "adapter",
        "generic": "advisory"
      },
      "legacyCapabilities": {
        "workspaceRead": true,
        "workspaceWrite": true,
        "shell": "prompt",
        "network": false,
        "credentials": false,
        "userScopeMutation": false,
        "externalPublish": false,
        "gitHistoryMutation": false
      },
      "compatibility": "Requires Node.js 22+, Bash 3.2+, an authenticated Codex CLI, and network access for the external review/fix/verify loop."
    },
    {
      "id": "codex-review-only",
      "canonicalSurfaceId": "review",
      "variantPreset": {
        "REVIEW_PROFILE": "codex-review-only"
      },
      "compatibilityAlias": true,
      "destructiveActions": "low",
      "modelInvocable": false,
      "subagentSafe": true,
      "allowedTools": [
        "Read",
        "Glob",
        "Grep"
      ],
      "disallowedTools": [
        "Write",
        "Edit",
        "NotebookEdit"
      ],
      "runtimeRequirements": {
        "executables": [
          {
            "name": "node",
            "required": true,
            "versionEvidence": "versioned-evidence"
          },
          {
            "name": "bash",
            "required": true,
            "versionEvidence": "versioned-evidence"
          },
          {
            "name": "codex",
            "required": true,
            "versionEvidence": "versioned-evidence"
          }
        ],
        "network": {
          "need": "required",
          "purpose": "external review"
        },
        "credentials": {
          "need": "required",
          "source": "assistant-owned-authentication"
        }
      },
      "permissionPolicy": {
        "workspaceRead": "preapproved",
        "workspaceWrite": "denied",
        "shell": "prompt",
        "network": "prompt",
        "credentials": "explicit",
        "userScopeMutation": "denied",
        "externalPublish": "denied",
        "gitHistoryMutation": "denied"
      },
      "enforcement": {
        "claude": "native-and-hook",
        "codex": "adapter",
        "generic": "advisory"
      },
      "legacyCapabilities": {
        "workspaceRead": true,
        "workspaceWrite": false,
        "shell": "prompt",
        "network": false,
        "credentials": false,
        "userScopeMutation": false,
        "externalPublish": false,
        "gitHistoryMutation": false
      },
      "compatibility": "Requires Node.js 22+, Bash 3.2+, an authenticated Codex CLI, and network access; Bash is not pre-approved."
    },
    {
      "id": "codex-verify-only",
      "canonicalSurfaceId": "review",
      "variantPreset": {
        "REVIEW_PROFILE": "codex-verify-only"
      },
      "compatibilityAlias": true,
      "destructiveActions": "low",
      "modelInvocable": false,
      "subagentSafe": true,
      "allowedTools": [
        "Read",
        "Glob",
        "Grep"
      ],
      "disallowedTools": [
        "Write",
        "Edit",
        "NotebookEdit"
      ],
      "runtimeRequirements": {
        "executables": [
          {
            "name": "node",
            "required": true,
            "versionEvidence": "versioned-evidence"
          },
          {
            "name": "bash",
            "required": true,
            "versionEvidence": "versioned-evidence"
          },
          {
            "name": "codex",
            "required": true,
            "versionEvidence": "versioned-evidence"
          }
        ],
        "network": {
          "need": "required",
          "purpose": "external verification"
        },
        "credentials": {
          "need": "required",
          "source": "assistant-owned-authentication"
        }
      },
      "permissionPolicy": {
        "workspaceRead": "preapproved",
        "workspaceWrite": "denied",
        "shell": "prompt",
        "network": "prompt",
        "credentials": "explicit",
        "userScopeMutation": "denied",
        "externalPublish": "denied",
        "gitHistoryMutation": "denied"
      },
      "enforcement": {
        "claude": "native-and-hook",
        "codex": "adapter",
        "generic": "advisory"
      },
      "legacyCapabilities": {
        "workspaceRead": true,
        "workspaceWrite": false,
        "shell": "prompt",
        "network": false,
        "credentials": false,
        "userScopeMutation": false,
        "externalPublish": false,
        "gitHistoryMutation": false
      },
      "compatibility": "Requires Node.js 22+, Bash 3.2+, an authenticated Codex CLI, and network access; Bash is not pre-approved."
    },
    {
      "id": "explore",
      "canonicalSurfaceId": "explore",
      "variantPreset": {},
      "compatibilityAlias": false,
      "destructiveActions": "none",
      "modelInvocable": true,
      "subagentSafe": true,
      "allowedTools": [
        "Read",
        "Glob",
        "Grep"
      ],
      "disallowedTools": [
        "Write",
        "Edit",
        "NotebookEdit",
        "Bash"
      ],
      "runtimeRequirements": {
        "executables": [],
        "network": {
          "need": "none",
          "purpose": "none"
        },
        "credentials": {
          "need": "none",
          "source": "none"
        }
      },
      "permissionPolicy": {
        "workspaceRead": "preapproved",
        "workspaceWrite": "denied",
        "shell": "denied",
        "network": "denied",
        "credentials": "denied",
        "userScopeMutation": "denied",
        "externalPublish": "denied",
        "gitHistoryMutation": "denied"
      },
      "enforcement": {
        "claude": "native-and-hook",
        "codex": "adapter",
        "generic": "advisory"
      },
      "legacyCapabilities": {
        "workspaceRead": true,
        "workspaceWrite": false,
        "shell": "denied",